name,title,description,creator,youtube_url,template_url,date_posted,resource_url,id
RAG AI Agent,Create This RAG n8n AI Agent in 30 Minutes (You'll Use This Daily),"In this video, Jono Catliff builds a fully functional RAG AI agent workflow using n8n. The system uses Google Drive as a trigger to detect new documents, uploads file data to a Pinecone vector store with OpenAI text embeddings and a recursive text splitter, and integrates Airtable to automatically generate tasks. This detailed example shows the integration of APIs and AI agents within a robust automation pipeline. The free blueprint template is provided by the creator on Gumroad.",Jono Catliff,https://www.youtube.com/watch?v=KC34sUqgU5A,https://drive.google.com/file/d/1DePiMuwOnKru3Llo2uZjVPaj9VKLxKcs/view?usp=drive_link  https://drive.google.com/file/d/1teQpVLs-3_nX6itv0GjRH5sg9yte2LB8/view?usp=drive_link ,2025-02-14T01:18:12.000Z,https://gumroad.com/d/67e085d486bd6fa5825ef73750392c93,KC34sUqgU5A
Automated Email Manager,This n8n AI Agent Will Manage Your Email Inbox (100% Automatic),"Jono Catliff demonstrates an AI-powered email management system for Gmail that uses a free n8n workflow. The workflow automatically classifies emails into categories such as promotions, social, personal, sales, receipts, and miscellaneous using an AI text classifier powered by ChatGPT (GPT-4 mini). It then performs actions like labeling, summarizing, drafting replies, forwarding messages, and appending data to Google Sheets. The system integrates Gmail, OpenAI, Google Sheets, and custom logic. Free blueprint available on Gumroad.",Jono Catliff,https://www.youtube.com/watch?v=l0SiFihbetA,https://drive.google.com/file/d/16fEk0SgtcGqijGYBIrmZgfR13AQAJJX9/view?usp=drive_link,2025-02-12T23:17:49.000Z,https://gumroad.com/d/3de675e1ed25174fd07a331abc42e158,l0SiFihbetA
Human-in-Loop Workflow,n8n Tutorial: AI Agents with Human Feedback,"Leon van Zyl demonstrates a sophisticated multi-agent AI system that orchestrates a storytelling process with human feedback checkpoints. The workflow sequentially generates a story premise, characters, and outline, integrating Telegram for real-time feedback, Gmail for email delivery, and OpenAI's GPT models for content generation. The video details how to set up decision points using text classifiers and set nodes, with a free downloadable template available via the linked workflow prompt.",Leon van Zyl,https://www.youtube.com/watch?v=4wsV1GgIsrs,https://drive.google.com/file/d/1cjOP713BwHJNrQq8tbZe2JtHi6kQA1i5/view?usp=drive_link  https://drive.google.com/file/d/1dIWQlEIHHl7TCZwg7HjnwuoilyqceKLt/view?usp=drive_link ,2025-02-11T14:14:59.000Z,https://drive.google.com/drive/folders/18bbq_Iu8GCxkFMSVAQy3IYboA8GBwdVF,4wsV1GgIsrs
Instagram Parasite System,The N8N Instagram Parasite System (10K Followers In 15 Days),"Nick Saraev demonstrates a complete Instagram scraping and content repurposing workflow built on n8n. This system uses Apify to scrape Instagram Reels from niche profiles, then processes the data via HTTP requests, integrates with Google Sheets for record management, and uses OpenAI Whisper for video transcription. Advanced steps include filtering with AI (GPT and Perplexity) to generate tailored content, making it ideal for automating social media growth. A free template is provided.",Nick Saraev,https://www.youtube.com/watch?v=9zBtU1mwOR4,https://drive.google.com/file/d/1TF418y0Ff1XmXVMlna0olcW8iXbUSFdP/view?usp=drive_link,2025-02-11T04:00:05.000Z,https://gumroad.com/d/5ac7a3dd6ae9ae61d437ec95b09d47dd,9zBtU1mwOR4
Agentic Workflow Systems,4 Agentic Frameworks for More Efficient Workflows in n8n,"In this video tutorial, Nate Herk showcases four specialized frameworks—prompt chaining, routing, parallelization, and evaluator optimizer—built using an n8n system. The workflows demonstrate sequential processing for blog generation, email classification with Gmail, Telegram alerts for high priority tasks, parallel data analysis with distinct LLMs, and an iterative optimization loop that refines outputs via Google Docs integration. Free templates for these agent-driven workflows are available in the community.",Nate Herk | AI Automation,https://www.youtube.com/watch?v=nSQnJoqK4DQ,https://drive.google.com/file/d/1d6rikqHI_20LQtV3az7O1jIlgxXwOxDi/view?usp=drive_link  https://drive.google.com/file/d/1ZonJFV6B8U2px_-Fe8WblUDfNvsKomZf/view?usp=drive_link  https://drive.google.com/file/d/1f-AqEGZ8b-EIHwfLtxz9QMexEQ-pcYbg/view?usp=drive_link  https://drive.google.com/file/d/1tKgq5uXibES3KSNZi7RkMBiixQxQ7UeL/view?usp=drive_link ,2025-02-10T16:03:00.000Z,https://www.skool.com/ai-automation-society/new-video-4-agentic-frameworks-for-more-efficient-workflows-in-n8n,nSQnJoqK4DQ
AI Agent Calendar & Sheets Bot,Build Your First No-Code n8n AI Agent (Beginner's Guide),"Jono Catliff’s video details a dual AI agent workflow built in n8n. The first agent processes internal chat messages using integrated calculator and Wikipedia modules via an OpenAI chat model and memory. The second agent uses Telegram to handle text and voice inputs, transcribe audio, and automate Google Calendar event creation/updating with logging to Google Sheets. This setup demonstrates advanced multi-tool AI automation with dynamic scheduling and conflict management. Free blueprint templates are available at the provided link.",Jono Catliff,https://www.youtube.com/watch?v=81prU7h9yWs,https://drive.google.com/file/d/1JcVrQKNTzgqbJcj0EMFbtWjiUK5Fk_mt/view?usp=drive_link  https://drive.google.com/file/d/1G1X-kX70sMy-bmU1ppUJegqOXOONvRK4/view?usp=drive_link ,2025-02-09T19:00:04.000Z,https://gumroad.com/d/5cde98c0de8290b38fe6cddf5bb3e7ac,81prU7h9yWs
AI Memory Assistant,Build an AI Agent That Actually Remembers You (n8n Tutorial),"Leon van Zyl presents a detailed workflow that enables an AI agent to retain long-term user memories. The system integrates chat triggers, OpenAI's GPT40 Mini for processing, and Airtable to store and retrieve conversation memories. It utilizes merging of current chat inputs with aggregated past memories and injects them into the system prompt, effectively personalizing responses much like ChatGPT's memory feature. The free template download is provided via a direct link in the video description.",Leon van Zyl,https://www.youtube.com/watch?v=t_azqARQSb8,https://drive.google.com/file/d/1WwQi8GjaPJgFCc5UWv5gHTig-Any8kAz/view?usp=drive_link  https://drive.google.com/file/d/1ux94BknPxPV6wqUW8AtBq6hR71Xf914R/view?usp=drive_link ,2025-02-06T15:30:30.000Z,https://drive.google.com/drive/folders/1Ui0GAiml45EWmfaLiqCqRxfR1bNgcs1Z,t_azqARQSb8
AI Price Tracker,Watch Me Build a $7.5k AI Price Tracker in 40 min (N8N) (No-Code),"This system is a no-code AI competitor price tracker that automates price monitoring for e-commerce brands. It uses a workflow built in n8n to scrape product prices via HTTP requests and advanced scraping techniques (including bypassing anti-scraping measures with Scrapperfly), extracts prices with a language model (Google Gemini), updates Google Sheets, and visualizes data in Looker Studio while triggering Slack notifications on price changes. Developed by Ben AI, it comes with a free template available through his community.",Ben AI,https://www.youtube.com/watch?v=KFB6BBcbIjg,https://drive.google.com/file/d/1vPITJg2ceRPUAqvIWlelg069sJebyaER/view?usp=drive_link,2025-02-06T08:00:16.000Z,https://bens-ai.circle.so/c/freebie-resources/ai-competitor-price-tracker-n8n-lookerstudio,KFB6BBcbIjg
Human Loop Sales,I Built a Human In The Loop Sales Team That Waits for Feedback and Approval in n8n,"This workflow implements a human-in-the-loop solution for AI-driven sales email outreach. It uses an Airtable trigger to capture leads, then an AI sales agent generates personalized emails while a revision agent refines them based on human feedback via Gmail. With a structured output parser splitting email subjects and bodies, the system leverages Claude 3.5 for content generation. Created by Nate Herk, the workflow is available as a free downloadable template via his community.",Nate Herk | AI Automation,https://www.youtube.com/watch?v=FcAAlOw6KZ8,https://drive.google.com/file/d/1t64LWOhddRMDPFi1OfOpBlRn7cHqiMhM/view?usp=drive_link,2025-02-05T21:12:28.000Z,https://www.skool.com/ai-automation-society/new-video-i-built-a-human-in-the-loop-sales-team-that-waits-for-feedback-and-approval-in-n8n,FcAAlOw6KZ8
AI Proposal Generator,"I Built A $2,485 AI Proposal Generator In N8N (Copy This)","Dynamic AI Proposal Generator is an automated workflow built on n8n that converts form input into professional, customized proposals. The system duplicates and customizes a Google Slides template by replacing text fields with AI-generated content via the OpenAI API. It also integrates with Gmail for automated delivery and supports Pandadoc enhancements. Created by Nick Saraev, this video provides a free-use template hosted on Gumroad.",Nick Saraev,https://www.youtube.com/watch?v=viN9gX030T4,https://drive.google.com/file/d/1ILUbRyqO4i-rQO3V8MGjHXV9PLneNe6r/view?usp=drive_link,2025-02-05T02:45:07.000Z,https://gumroad.com/d/235a1abef98a1a2e62caa95447603811,viN9gX030T4
Ultimate AI Assistant,I Built the Ultimate Team of AI Agents in n8n With No Code (Free Template),"This video by Nate Herk showcases a no-code automation system built in n8n that orchestrates a team of specialized AI agents. The workflow integrates an email agent, calendar agent, content creator agent, and contact agent to manage tasks such as sending emails, creating calendar events, drafting blog posts, and updating contacts. It leverages GPT-4 and Claude 3.5 Sonet along with APIs for Gmail, Airtable, and calendar services. The system’s modular design, dynamic tool calls, and multi-step processing are highlighted with demos and a free downloadable JSON template.",Nate Herk | AI Automation,https://www.youtube.com/watch?v=9FuNtfsnRNo,https://drive.google.com/file/d/1jeWlCmi_aOGEsvUcIexGNyj9RI8oUMs5/view?usp=drive_link  https://drive.google.com/file/d/1nXudDokTVGBJohdS_jUKqcUTj1CYO9aO/view?usp=drive_link  https://drive.google.com/file/d/16hT112vkKH7WPBd1gXVMzDuGimIMehLq/view?usp=drive_link  https://drive.google.com/file/d/12vo-ispmMjBpIqTKcvJOXlA7llcbntCc/view?usp=drive_link  https://drive.google.com/file/d/1pj4L9NOwECWs0raucJPkWheR_AcTaQyM/view?usp=drive_link ,2025-02-03T04:05:00.000Z,https://www.skool.com/ai-automation-society/new-video-i-built-the-ultimate-team-of-ai-agents-in-n8n-with-no-code-free-template,9FuNtfsnRNo
Travel Agent Workflow,OpenAI Fires Back at DeepSeek With a New Reasoning Model: o3-mini (n8n AI Agent),"This video by Nate Herk demonstrates a system that integrates OpenAI’s new O3 Mini reasoning model as an AI agent within an automation workflow. The tutorial builds a travel agent that pulls data from three Pinecone databases (resorts, flights, and activities), formats an HTML itinerary, and sends it via a Gmail tool. The video details prompt engineering, sequential tool calls, and includes a free downloadable workflow template available through his free Skool community.",Nate Herk | AI Automation,https://www.youtube.com/watch?v=IBaT-XQm_wE,https://drive.google.com/file/d/1RWYii5r5yOSIItRc-_6aNtXGmd-ltEA0/view?usp=drive_link  https://drive.google.com/file/d/1z7Pj1D9uiRLMfwpu2ofB1SGLSDhKSFTY/view?usp=drive_link ,2025-02-01T19:14:02.000Z,https://www.skool.com/ai-automation-society/new-video-openai-fires-back-at-deepseek-with-a-new-reasoning-model-o3-mini-n8n-ai-agent,IBaT-XQm_wE
Gmail HR Workflow,How to process with AI 500 CVs from your Gmail in 1 hour,"This system automates HR processes by using a Gmail trigger to capture incoming CV emails and process multiple attachments such as PDFs and DOC files. It extracts and aggregates text, then uses OpenAI API to match CV data against job listings stored in Airtable and score candidates based on custom criteria. Error handling is implemented via loops and conditions, ensuring robust processing. Created by Mark and Philipp from 5minAI, this walkthrough includes a free workflow template.",5minAI,https://www.youtube.com/watch?v=iNjFF4RzoVg,https://drive.google.com/file/d/1Iz1z5Xb1ceiwKIkM632kQZaHfYmkkIqH/view?usp=drive_link,2025-02-01T13:32:35.000Z,https://www.skool.com/5minai/classroom/b4afa5e9?md=42d782508ac943da92cce06d1f1bd470,iNjFF4RzoVg
RAG Experiment System,Best Model for RAG? GPT-4o vs Claude 3.5 vs Gemini Flash 2.0 (n8n Experiment Results),"In this detailed workflow, Nate Herk demonstrates a RAG (Retrieval-Augmented Generation) system that compares three AI models—GPT-4o, Claude 3.5, and Gemini Flash 2.0. The n8n-based setup integrates vector database queries to fetch Nvidia financial data and uses dynamic tool calls to generate, evaluate, and grade responses over multiple parameters such as speed, query understanding, and context management. The free template is available via his Skool community.",Nate Herk | AI Automation,https://www.youtube.com/watch?v=_DbZjllXDv8,https://drive.google.com/file/d/1U74wSgEZOVT8Hl6Z9XhLzlmg38CPGAhq/view?usp=drive_link,2025-01-30T00:21:28.000Z,https://www.skool.com/ai-automation-society/new-video-best-model-for-rag-gpt-4o-vs-claude-35-vs-gemini-flash-20-n8n-experiment-results,_DbZjllXDv8
Cold Email AI Workflow,"N8N Foundational Concepts (AI Agents, JSON, Logic)","This comprehensive workflow automates personalized cold email outreach by integrating a Google Sheets trigger for lead data, OpenAI for generating dynamic email subject lines, icebreakers, elevator pitches, and Gmail for drafting emails. It showcases advanced techniques using fixed vs expression fields, JSON manipulation, looping, filtering, and merging to build robust business processes. Created by Nick Saraev.",Nick Saraev,https://www.youtube.com/watch?v=6b442bN0CyI,https://drive.google.com/file/d/1H92R8P6Q8zRHbbbU9ZJl4XvI09Tn6PnP/view?usp=drive_link,2025-01-28T03:30:06.000Z,https://gumroad.com/d/c3acce8187529216735bb8a98896454c,6b442bN0CyI
Crawl4AI Web Scraper,n8n + Crawl4AI - Scrape ANY Website in Minutes with NO Code,"This system integrates an open-source web scraping engine deployed via Docker with a no-code workflow that automates website crawling, content extraction, and data ingestion for retrieval-augmented generation. The workflow uses HTTP requests to trigger asynchronous scraping tasks, parses sitemap.xml for URLs, processes markdown and HTML responses, and feeds vector embeddings (via OpenAI) into a Supabase vector store. The process also includes AI agent components such as Pydantic AI and TEN Agent. Creator Cole Medin demonstrates step-by-step deployment and integration techniques in this free template workflow.",Cole Medin,https://www.youtube.com/watch?v=c5dw_jsGNBk,https://drive.google.com/file/d/1nUl0j6Y7HQRcE2sOOsU8hx9lTlVSMHJC/view?usp=drive_link  https://drive.google.com/file/d/159iNaTq4b4sO2LJY87Og7svvFB3RuBd_/view?usp=drive_link  https://drive.google.com/file/d/1UsJuUUq-63fQKGPNwnAZ3sNGwS-0Tntg/view?usp=drive_link  https://drive.google.com/file/d/1GOrBLRSOnEBkaG_ZzBr_hsPa9LEB615-/view?usp=drive_link ,2025-01-27T01:00:24.000Z,https://github.com/TEN-framework/ten-framework,c5dw_jsGNBk
DeepSeek R1 Planner,How to Actually Build Agents with DeepSeek R1 in n8n (Without OpenRouter),"In this workflow, creator Nate Herk demonstrates a system that integrates the DeepSeek R1 reasoning model as a planning agent to handle real-world automation tasks like email sending and calendar event creation. The setup uses an HTTP request to connect directly to DeepSeek’s API, bypassing OpenRouter, and splits responsibilities between a planning agent that converts user commands into detailed step-by-step instructions and a tools agent that executes the tasks using other models such as GPT-4 or Claude 3.5. The free template is available through his community link.",Nate Herk | AI Automation,https://www.youtube.com/watch?v=tjaD65OCoE8,https://drive.google.com/file/d/1fjOajCeqbE1flHCpx5Kq0qr8nvoMsMVN/view?usp=drive_link,2025-01-24T17:17:32.000Z,https://www.skool.com/ai-automation-society/new-video-how-to-actually-build-agents-with-deepseek-r1-in-n8n-without-openrouter,tjaD65OCoE8
Business Automation Suite,"N8N For Everyone (AI Agents, Workflows, & More)","In this comprehensive tutorial by Nick Saraev, the creator demonstrates how to build complete automated workflows using n8n. The video walks through setting up triggers—from manual activation and form submissions to API events from cal.com—and integrates multiple actions such as sending personalized emails via Gmail, using OpenAI for dynamic content, and updating CRM records in ClickUp. A free template collection for these workflows is available at the linked Gumroad page.",Nick Saraev,https://www.youtube.com/watch?v=r6uX3btBgvw,https://drive.google.com/file/d/1qsO-s48nDhyv-xC6x9AO06W1hbdYxOGJ/view?usp=drive_link,2025-01-24T03:45:02.000Z,https://gumroad.com/d/27b4bdfc2f8a39eb69ab5de2ccb420df,r6uX3btBgvw
DeepSeek R1 Workflow,Two Ways to Save 96% of Your Money Using DeepSeek R1 in n8n,"This system, presented by Nate Herk, demonstrates a technical integration of DeepSeek R1—a cost-effective, reinforcement learning driven AI model—into a workflow using Chat Model and HTTP Request nodes. The video explains setting up API credentials via OpenRouter, cost comparisons with OpenAI models, and details how to download the free workflow template from the free Skool community. Keywords: DeepSeek R1, API, HTTP, reinforcement learning, cost efficiency.",Nate Herk | AI Automation,https://www.youtube.com/watch?v=o69yGTxB8EE,https://drive.google.com/file/d/15Uf3Dk_0ilgXXbfPbU-H1_fczj7Er9md/view?usp=drive_link,2025-01-23T14:37:30.000Z,https://www.skool.com/ai-automation-society/new-video-two-ways-to-save-96-of-your-money-using-deepseek-r1-in-n8n,o69yGTxB8EE
Omni AI Assistant,Build Your OWN AI Agent That Can SEE And SPEAK With Ease,"Leon van Zyl demonstrates a full-featured AI agent workflow that processes text, voice, and images without coding. This system integrates Telegram triggers, voice transcription, and text-to-speech capabilities alongside advanced OpenAI chat and image analysis. Additional tools include Gmail for email handling, Google Calendar for scheduling, SERP API for web search, and Pinecone for a custom knowledge base. The workflow uses dynamic system prompts and switch nodes for multimodal input management. A free downloadable template is provided.",Leon van Zyl,https://www.youtube.com/watch?v=cTvaMD4Tt9Y,https://drive.google.com/file/d/154CXEPU9aInFDPu5VeXmPyp2l9PRI2OV/view?usp=drive_link  https://drive.google.com/file/d/1OgJheom6elKiDngLw96h3H6Xh8Q1EF7T/view?usp=drive_link ,2025-01-21T11:00:46.000Z,https://drive.google.com/drive/folders/1-dG6w8iNc5f9F9CqZvLUADriZrZKW0i-,cTvaMD4Tt9Y
Video Audition Analyzer,How to analyse any video with Gemini AI in N8N,"This system automates the review of audition tapes by integrating Google Drive, Gemini AI (using Jimini API), and Airtable into one seamless workflow built on n8n. It starts with a Google Drive trigger to upload video files, then passes them via HTTP requests and file download/upload modules to Gemini AI for emotional and facial analysis. The AI returns ratings and comments that are stored in Airtable, enabling rapid candidate evaluation. Developed by Mark and Philipp on the 5minAI channel, the full workflow is available via the linked free template.",5minAI,https://www.youtube.com/watch?v=zehXwwnH8d0,https://drive.google.com/file/d/18LCOLhvfUCIEifES9g7_bzAkQspp2jGp/view?usp=drive_link,2025-01-20T22:08:23.000Z,https://www.skool.com/5minai/classroom/b4afa5e9?md=b260bb4d8461415e89623bfa1d72f725,zehXwwnH8d0
Tech Analyst Agent,How I Built A Technical Analyst AI Agent in n8n With No Code,"This workflow builds a technical analysis agent using n8n. It triggers via Telegram to receive stock tickers (e.g., Apple), then sends an HTTP POST to a free chart-image API to generate technical charts and retrieves the image via an HTTP GET. The workflow processes the chart with AI nodes (Anthropic 3.5 and OpenAI image analysis) to produce detailed technical insights. Developed by Nate Herk, the free template is available via his Skool community.",Nate Herk | AI Automation,https://www.youtube.com/watch?v=dooXxhGy5Ow,https://drive.google.com/file/d/1S1t9eQmgYXVML6kWmOBZfJjyg563ppdi/view?usp=drive_link,2025-01-17T20:41:31.000Z,https://www.skool.com/ai-automation-society/new-video-how-i-built-a-technical-analyst-ai-agent-in-n8n-with-no-code,dooXxhGy5Ow
Email AI Agent,"How I'd Teach a 10 Year Old to Build AI Agents (No Code, n8n)","In this tutorial video by Nate Herk, a complete workflow is built in n8n for creating an AI-powered email agent. The system combines an OpenAI chat model for processing user inputs, window buffer memory for maintaining conversation context, a Gmail tool for sending emails, and a Google Sheets contact database for dynamically retrieving recipient information. The video demonstrates setting up credentials, configuring dynamic expressions for email contents, and updating system prompts. Free access is provided via his free Skool community, where the workflow template is available.",Nate Herk | AI Automation,https://www.youtube.com/watch?v=6DLZK7XDOGo,https://drive.google.com/file/d/1pkdI5-ezSEHMv1IuNqniaM60lMtnt04k/view?usp=drive_link,2025-01-17T04:08:31.000Z,https://www.skool.com/ai-automation-society/new-video-how-id-teach-a-10-year-old-to-build-ai-agents,6DLZK7XDOGo
Customer Support Automation,This AI Agent Handled 1000+ Support Tickets (Here's How),"This system automates customer support by handling FAQs, package tracking, ticket creation, and call scheduling through a sophisticated AI agent workflow. It integrates an AI agent with OpenAI, manages dynamic chat memory via Postgres, and leverages document retrieval using Supabase as a vector store. Additional modules interact with Airtable for database operations and Google Drive/Calendar for document management and scheduling. The guide, provided by Mark and Philipp of 5minAI, offers a free template in the community.",5minAI,https://www.youtube.com/watch?v=LCRxRnsWErs,https://drive.google.com/file/d/1SeslCyoTxjySKkppm2aCkSOcnuQw7W_D/view?usp=drive_link,2025-01-14T12:58:09.000Z,https://www.skool.com/5minai/classroom/b4afa5e9?md=6f29b440e19e4cf39e067b62c346e86f,LCRxRnsWErs
Voice RAG Agent,Having an Actual Conversation with Data Using an ElevenLabs Voice Agent and n8n,"This video demonstrates a complete n8n workflow that integrates a conversational voice AI agent using ElevenLabs with a vector database (Pine Cone) for Retrieval Augmented Generation (RAG). The system pulls project data from a Google Doc via n8n workflows, processes user queries through a webhook, and responds with natural voice interactions. Creator Nate Herk explains how to set up the web hook, the ElevenLabs voice agent, and the vector search, offering a free template available in his Skool community.",Nate Herk | AI Automation,https://www.youtube.com/watch?v=pJYm7MOyMH0,https://drive.google.com/file/d/1ix9Oihxw8GUT-VBdgBoL_7NoHFg-wvKW/view?usp=drive_link  https://drive.google.com/file/d/1YEc-zjlRwW0q8xX2HaCBbuXzlv5m_c-p/view?usp=drive_link ,2025-01-13T01:14:28.000Z,https://www.skool.com/ai-automation-society/new-video-having-an-actual-conversation-with-data-using-an-elevenlabs-voice-agent,pJYm7MOyMH0
Telegram Chatbot Workflow,Flowise AI Tutorial (2025) #12 - Telegram Integration,"In this tutorial, Leon van Zyl shows how to build a Telegram chatbot workflow that integrates Flowise AI with an automation tool. The system uses Telegram triggers to receive messages and HTTP request nodes to post queries to Flowise’s API endpoints. It manages chat history and context by passing chat IDs, and incorporates SER API and OpenAI credentials for web search and text generation. The free template is available via the course resources on GitHub.",Leon van Zyl,https://www.youtube.com/watch?v=o8yhnqCF2gs,https://drive.google.com/file/d/1puYPa55_fP14zxK8us4qb83dSOB30zFK/view?usp=drive_link  https://drive.google.com/file/d/1Xf-nw-sR_n7oGlCVrGgHE8hHXRZLv_H6/view?usp=drive_link  https://drive.google.com/file/d/1XRC2kHjweSajJ_e96i11EpFzZTI2_ovc/view?usp=drive_link  https://drive.google.com/file/d/152LPpnD3gJuKZXvINXVYZ68HqUwL6NE3/view?usp=drive_link  https://drive.google.com/file/d/1qxOCjhI7ki5QZda8e0QeuJeNUjN5weY5/view?usp=drive_link  https://drive.google.com/file/d/13d8PL79x7RA3gH9fC1_vxXjPr9KiOFLf/view?usp=drive_link ,2025-01-11T08:58:22.000Z,https://github.com/leonvanzyl/flowise-masterclass-2025/tree/master/Software%20Development%20Team,o8yhnqCF2gs
Airtable AI Agent,DOUBLE Your Business with this AI Agent for Airtable,"This workflow integrates an AI agent with Airtable data, enabling dynamic data queries, math operations, filtering, and map generation. It uses a chat-based agent configuration with OpenAI for code interpretation and response generation, and Mapbox for visual mapping. The system is implemented in n8n and is designed to automatically retrieve base and schema details from Airtable. Created by Mark and Philipp from 5minAI, it comes with a free template available for community use.",5minAI,https://www.youtube.com/watch?v=SotqsAZEhdc,https://drive.google.com/file/d/1YfhuXF3KnSeiFn19IOyp9KQx7Lb2uSOD/view?usp=drive_link,2025-01-06T19:28:43.000Z,https://www.skool.com/5minai/classroom/b4afa5e9?md=1aca488cac3f4d37ae20e39564fb85f7,SotqsAZEhdc
